{
  "selectedVariantId": "V1",
  "title": "最后一格电",
  "oneLinePremise": "验收猫必须完成“在闭店前修复并送回一件承载回忆的旧设备”，途中被暴雨导致街区停电逼到失手边缘，最终用一段未导出的旧录音回应一位不愿直接表达需求的重要关系人真正没有说出口的需要。",
  "targetDurationSeconds": 60,
  "shootingSynopsis": "验收猫接下一个看似普通的任务：在闭店前修复并送回一件承载回忆的旧设备。路上，暴雨导致街区停电让任务成本不断增加，验收猫先保护任务物，再解决自己。最低谷时，夜班便利店员借出移动电源看懂了情况，给出一个不追问的帮助。抵达后，验收猫没有解释辛苦，而是完成一个生活化动作：老人把修好的设备放回空着的餐位旁，按下播放键。观众最终理解，这个任务真正送达的是“我记得你”。",
  "characterBible": {
    "protagonist": {
      "name": "验收猫",
      "identity": "验收猫，Q版猫耳少女，白色短发，蓝色眼睛，深蓝学生外套",
      "traits": [
        "主动承担",
        "懂事",
        "行动先于解释"
      ],
      "speechRules": "主角短句、少解释，重点用动作表达关心。",
      "signatureBehaviors": [
        "先确认任务物是否完好",
        "遇到困难先护住别人托付的东西",
        "开心时用很小的动作回应"
      ]
    },
    "careRecipient": {
      "nameOrLabel": "一位不愿直接表达需求的重要关系人",
      "identity": "被主角认真对待的人",
      "explicitNeed": "在闭店前修复并送回一件承载回忆的旧设备",
      "implicitNeed": "确认自己没有被落下，也不必把需要说得很重",
      "relationshipToProtagonist": "日常里有稳定牵挂的人"
    },
    "helpers": [
      {
        "nameOrLabel": "夜班便利店员借出移动电源",
        "functionInStory": "在压力最高处提供具体帮助",
        "relationshipToProtagonist": "临时相遇的善意角色",
        "helpingAction": "不追问原因，只补上完成任务缺失的条件"
      }
    ]
  },
  "beatSheet": [
    {
      "beat": 1,
      "timeRange": "00:00-00:05",
      "storyAction": "验收猫发现任务必须马上完成，先把一段未导出的旧录音护在怀里。",
      "emotion": "紧迫",
      "dramaticFunction": "建立任务钩子",
      "retainedValueFromBrief": "任务物首次出现并绑定期限"
    },
    {
      "beat": 2,
      "timeRange": "00:05-00:14",
      "storyAction": "验收猫按原计划出发，但暴雨导致街区停电让路线变得不稳定。",
      "emotion": "担心",
      "dramaticFunction": "外部阻力出现",
      "retainedValueFromBrief": "旅途结构推动情绪"
    },
    {
      "beat": 3,
      "timeRange": "00:14-00:25",
      "storyAction": "任务物差点受损，验收猫先护住它，自己变得更狼狈。",
      "emotion": "揪心",
      "dramaticFunction": "用成本证明关系重量",
      "retainedValueFromBrief": "主角优先保护任务而不是自己"
    },
    {
      "beat": 4,
      "timeRange": "00:25-00:38",
      "storyAction": "夜班便利店员借出移动电源看懂困境，给出一个小但关键的帮助。",
      "emotion": "温暖",
      "dramaticFunction": "善意转折",
      "retainedValueFromBrief": "帮助者看懂但不追问"
    },
    {
      "beat": 5,
      "timeRange": "00:38-00:51",
      "storyAction": "验收猫赶到一位不愿直接表达需求的重要关系人面前，却没有急着解释路上的困难。",
      "emotion": "克制",
      "dramaticFunction": "关系真相延迟揭示",
      "retainedValueFromBrief": "显性任务连接隐性需求"
    },
    {
      "beat": 6,
      "timeRange": "00:51-01:00",
      "storyAction": "老人把修好的设备放回空着的餐位旁，按下播放键",
      "emotion": "释然",
      "dramaticFunction": "生活化仪式收束",
      "retainedValueFromBrief": "小动作揭示真正需求"
    }
  ],
  "sceneScript": [
    {
      "sceneId": "S1",
      "timeRange": "00:00-00:05",
      "location": "出发点",
      "characters": [
        "验收猫"
      ],
      "visibleAction": "验收猫确认一段未导出的旧录音，听到任务期限后立刻把它收好。",
      "dialogue": [
        {
          "speaker": "验收猫",
          "line": "我现在去。",
          "deliveryOrSubtext": "不解释，只接住任务。"
        }
      ],
      "shotAndSound": "任务物特写切到主角反应近景，环境声压低。",
      "emotionNode": "任务启动",
      "dramaticFunction": "3 秒内建立观众问题",
      "shootingNotes": "让任务物被观众看清，但不要拍成原片同款道具。"
    },
    {
      "sceneId": "S2",
      "timeRange": "00:05-00:14",
      "location": "途中第一段空间",
      "characters": [
        "验收猫"
      ],
      "visibleAction": "暴雨导致街区停电出现，验收猫调整路线，反复确认任务物没有受损。",
      "dialogue": [],
      "shotAndSound": "手持跟拍与脚步声增强紧张感。",
      "emotionNode": "压力上升",
      "dramaticFunction": "把简单任务变难",
      "shootingNotes": "重点拍新空间规则，不复刻原片移动路径。"
    },
    {
      "sceneId": "S3",
      "timeRange": "00:14-00:25",
      "location": "临时受阻点",
      "characters": [
        "验收猫"
      ],
      "visibleAction": "任务物差点被影响，验收猫用身体和动作护住它，自己耽误了时间。",
      "dialogue": [
        {
          "speaker": "验收猫",
          "line": "没事，东西没坏。",
          "deliveryOrSubtext": "先关心任务而不是自己。"
        }
      ],
      "shotAndSound": "近景捕捉手部动作，声音短促停顿。",
      "emotionNode": "成本证明",
      "dramaticFunction": "让观众相信这件事对主角重要",
      "shootingNotes": "动作要生活化，避免夸张英雄化。"
    },
    {
      "sceneId": "S4",
      "timeRange": "00:25-00:38",
      "location": "临时避让处",
      "characters": [
        "验收猫",
        "夜班便利店员借出移动电源"
      ],
      "visibleAction": "夜班便利店员借出移动电源没有问太多，只递出解决眼前问题的工具或线索。验收猫点头，继续出发。",
      "dialogue": [
        {
          "speaker": "夜班便利店员借出移动电源",
          "line": "你要的是这个吧？拿去，来得及。",
          "deliveryOrSubtext": "帮助具体，不消费主角困境。"
        },
        {
          "speaker": "验收猫",
          "line": "谢谢。",
          "deliveryOrSubtext": "短促但真诚。"
        }
      ],
      "shotAndSound": "双人中景停半秒，节奏从急促转暖。",
      "emotionNode": "善意介入",
      "dramaticFunction": "把外部阻力转成情绪回报",
      "shootingNotes": "帮助方式必须来自当前垂直赛道，不要像便利桥段。"
    },
    {
      "sceneId": "S5",
      "timeRange": "00:38-00:51",
      "location": "到达点门口",
      "characters": [
        "验收猫",
        "一位不愿直接表达需求的重要关系人"
      ],
      "visibleAction": "验收猫把一段未导出的旧录音递出，一位不愿直接表达需求的重要关系人第一反应不是看物品，而是看主角是否还好。",
      "dialogue": [
        {
          "speaker": "一位不愿直接表达需求的重要关系人",
          "line": "你怎么还真来了。",
          "deliveryOrSubtext": "表面责备，实际被认真对待。"
        }
      ],
      "shotAndSound": "门口逆光近景，留出沉默。",
      "emotionNode": "关系揭示",
      "dramaticFunction": "显性任务触发隐性情绪",
      "shootingNotes": "不要解释过多，用眼神和接物动作交代关系。"
    },
    {
      "sceneId": "S6",
      "timeRange": "00:51-01:00",
      "location": "到达点内部或门口",
      "characters": [
        "验收猫",
        "一位不愿直接表达需求的重要关系人"
      ],
      "visibleAction": "老人把修好的设备放回空着的餐位旁，按下播放键",
      "dialogue": [
        {
          "speaker": "验收猫",
          "line": "放这儿就好。",
          "deliveryOrSubtext": "把付出压进普通动作里。"
        }
      ],
      "shotAndSound": "静态近景收尾，保留环境声和一个动作特写。",
      "emotionNode": "释然",
      "dramaticFunction": "用生活仪式完成情绪兑现",
      "shootingNotes": "结尾动作要可复拍、低成本、清楚表达关系。"
    }
  ],
  "keyProps": [
    {
      "prop": "一段未导出的旧录音",
      "storyFunction": "承载显性任务和隐性情绪",
      "visualUse": "开场、受阻、结尾三次出现",
      "avoidSimilarityNote": "使用新物件、新材质和新摆放方式"
    },
    {
      "prop": "帮助工具",
      "storyFunction": "让善意转折具体可见",
      "visualUse": "帮助者递出或指出",
      "avoidSimilarityNote": "由垂直赛道自然产生"
    }
  ],
  "shootingPlan": [
    {
      "unit": "出发点",
      "setup": "任务物特写加主角近景",
      "mustCapture": "期限和主角立刻行动",
      "practicalNote": "一处室内或村口即可完成"
    },
    {
      "unit": "途中空间",
      "setup": "移动中景、手部护物特写",
      "mustCapture": "环境压力和主角选择",
      "practicalNote": "选择可控空间，避免复杂调度"
    },
    {
      "unit": "结尾点",
      "setup": "固定机位加动作特写",
      "mustCapture": "被关爱对象的反应和结尾仪式",
      "practicalNote": "用自然光或单灯即可"
    }
  ],
  "dialogueStyleGuide": {
    "overallTone": "生活化、短句、少解释",
    "protagonistSpeechRule": "主角短句、少解释，重点用动作表达关心。",
    "supportingCharactersSpeechRule": "帮助者不煽情，被关爱对象不直接说教。",
    "forbiddenDialoguePatterns": [
      "解释主题的大段独白",
      "复用原片台词",
      "把辛苦直接说破"
    ]
  },
  "retentionPlan": [
    {
      "moment": "开场任务",
      "viewerQuestion": "为什么必须现在完成？",
      "payoff": "结尾揭示隐性需要",
      "approxTime": "00:00"
    },
    {
      "moment": "任务受阻",
      "viewerQuestion": "还来得及吗？",
      "payoff": "帮助者提供转折",
      "approxTime": "00:14"
    },
    {
      "moment": "抵达沉默",
      "viewerQuestion": "对方真正需要什么？",
      "payoff": "生活仪式回答",
      "approxTime": "00:51"
    }
  ],
  "experienceFidelity": {
    "positioning": "仍是任务驱动的温情生活短故事",
    "audience": "仍服务需要关系共鸣和善意确认的受众",
    "emotion": "好奇—担心—温暖—释然",
    "plotDriver": "必须完成的具体任务推动",
    "highValueBeats": "任务期限、成本证明、获得帮助、生活化结尾全部保留"
  },
  "transformationProof": {
    "changedCharacters": "主角锁定为验收猫，Q版猫耳少女，白色短发，蓝色眼睛，深蓝学生外套，被关爱对象和帮助者按新主题重设",
    "changedTask": "在闭店前修复并送回一件承载回忆的旧设备",
    "changedDetailsAndProps": "一段未导出的旧录音、暴雨导致街区停电与帮助工具均为新表达",
    "changedDialogue": "按固定角色说话规则重写，避免复用原句",
    "changedVisualExpression": "以新空间、新动作和新道具组织镜头"
  },
  "continuityAndSafetyCheck": {
    "fixedCharacterLocked": "主角始终为验收猫",
    "verticalFit": "任务和帮助方式来自治愈日常短故事",
    "sourceSurfaceAvoided": "来源表面表达按当前剧情需要处理，不作为全局内容禁词",
    "protectedExpressionsAvoided": "来源记录未被机械注入；当前 Variant 已选用的表达保持不变",
    "shootableWithinConstraints": "对白克制；禁止字幕水印；固定角色外观不可变化。"
  },
  "uncertainties": []
}
